{
  "schema_version": "motion_stimulus.v0",
  "motion_event_id": "mot_evt_rr003_demo_thought_001",
  "stimulus_id": "mot_stim_rr003_demo_context_nod",
  "stimulus_instance_id": "mot_inst_rr003_demo_thought_001",
  "source_class": "thought_context",
  "source_family": "thought_core_contextual",
  "source_origin": "thought_core",
  "requested_at": "2026-06-03T06:00:10Z",
  "kind": "posture",
  "request_mode": "play",
  "phase": "queued",
  "lifecycle_state": "queued",
  "safe_visible_state": "requested",
  "safe_display_name": "Context nod",
  "target_model_type": "vrm",
  "track_mask": [
    "neck",
    "head",
    "face"
  ],
  "priority_by_track": [
    {
      "track": "neck",
      "priority": 35
    },
    {
      "track": "head",
      "priority": 35
    },
    {
      "track": "face",
      "priority": 25
    }
  ],
  "requirements": {
    "required_tracks": [
      "neck",
      "head"
    ],
    "optional_tracks": [
      "face"
    ],
    "compatible_model_types": [
      "vrm"
    ],
    "provenance_required": false,
    "allow_degraded": true,
    "allow_fallback": true
  },
  "payload_ref": "motion.fixture.context_nod.v0",
  "intensity": "subtle",
  "duration_ms": 900,
  "loop": false,
  "loop_count": 0,
  "interrupt_policy": "ignore_if_busy",
  "fallback_state": "none",
  "fallback_used": false,
  "stop_reason": "none",
  "trace": {
    "event_id": "evt_rr003_demo_thought_001",
    "turn_id": "turn_rr003_demo_001",
    "episode_id": "ep_rr003_demo_001",
    "selection_id": "mot_sel_rr003_demo_thought_001",
    "runtime_result_id": "mot_res_rr003_demo_pending_002",
    "motion_event_id": "mot_evt_rr003_demo_thought_001",
    "stimulus_id": "mot_stim_rr003_demo_context_nod",
    "stimulus_instance_id": "mot_inst_rr003_demo_thought_001"
  },
  "redaction": {
    "redaction_status": "summary_only",
    "redaction_profile": "motion_contract_public_v0",
    "shareability_class": "source_static_fixture",
    "proof_layer": "source_static"
  },
  "safety": {
    "raw_user_text_shared": false,
    "raw_prompt_shared": false,
    "raw_media_shared": false,
    "raw_path_shared": false,
    "raw_asset_filename_shared": false,
    "provider_payload_shared": false,
    "home_assistant_route": false
  }
}
